{
  "schema_version": "motionkb/v3",
  "action_id": null,
  "display_name": null,
  "status": "candidate",
  "source_clip": {
    "fbx_or_anim": "mx_Inspecting_Ground_With_Torch.fbx",
    "guid": "9f9a3fd77816b0b4b8d5eb5e04d98730",
    "file_id": -203655887218126122,
    "clip_name": "mx_Inspecting_Ground_With_Torch"
  },
  "controller_state": null,
  "controller_layer": null,
  "trigger_param": null,
  "duration": 6.567,
  "frame_rate": 30,
  "loop": false,
  "overall_intent": null,
  "tags": [],
  "mask_coverage": {
    "upper_body": false,
    "hands": false,
    "lower_body": false
  },
  "channels": {
    "root": {
      "kind": "root",
      "state_label": "dynamic",
      "motion_magnitude": 0.1685,
      "raw_measurement": {
        "signal": "max(trans/1.9782, vert/1.8396, heading/131.8575)",
        "body_trans_horiz_stddev": 0.07134,
        "body_vert_range": 0.23889,
        "body_heading_stddev_deg": 22.225
      },
      "mean_body_height": 0.84475,
      "mean_body_tilt_deg": 47.743
    },
    "torso": {
      "kind": "fk_part",
      "state_label": "dynamic",
      "motion_magnitude": 0.4047,
      "raw_measurement": {
        "signal": "muscle_dof_stddev_rms",
        "raw_value": 0.12015,
        "divisor": 0.2969
      },
      "role": null,
      "motion_type": null,
      "contact": null,
      "constraint": null,
      "target": null,
      "motion_description": null,
      "mean_pose": {
        "Spine Front-Back": -0.30788,
        "Spine Left-Right": -0.13927,
        "Spine Twist Left-Right": -0.18473,
        "Chest Front-Back": -0.21398,
        "Chest Left-Right": -0.01498,
        "Chest Twist Left-Right": -0.01741,
        "UpperChest Front-Back": -0.4592,
        "UpperChest Left-Right": -0.07497,
        "UpperChest Twist Left-Right": -0.08624
      }
    },
    "head": {
      "kind": "fk_part",
      "state_label": "dynamic",
      "motion_magnitude": 0.3345,
      "raw_measurement": {
        "signal": "muscle_dof_stddev_rms",
        "raw_value": 0.16603,
        "divisor": 0.4963
      },
      "role": null,
      "motion_type": null,
      "contact": null,
      "constraint": null,
      "target": null,
      "motion_description": null,
      "mean_pose": {
        "Neck Nod Down-Up": 0.35234,
        "Neck Tilt Left-Right": -0.11952,
        "Neck Turn Left-Right": -0.38333,
        "Head Nod Down-Up": 0.44651,
        "Head Tilt Left-Right": 0.11988,
        "Head Turn Left-Right": -0.24219
      }
    },
    "left_arm": {
      "kind": "fk_part",
      "state_label": "dynamic",
      "motion_magnitude": 0.2935,
      "raw_measurement": {
        "signal": "muscle_dof_stddev_rms",
        "raw_value": 0.20149,
        "divisor": 0.6864
      },
      "role": null,
      "motion_type": null,
      "contact": null,
      "constraint": null,
      "target": null,
      "motion_description": null,
      "mean_pose": {
        "Left Shoulder Down-Up": 0.46874,
        "Left Shoulder Front-Back": -0.86041,
        "Left Arm Down-Up": 0.16214,
        "Left Arm Front-Back": 0.00944,
        "Left Arm Twist In-Out": 0.67078,
        "Left Forearm Stretch": 0.4427,
        "Left Forearm Twist In-Out": 0.29422,
        "Left Hand Down-Up": 0.04126,
        "Left Hand In-Out": 0.34515
      }
    },
    "right_arm": {
      "kind": "fk_part",
      "state_label": "dynamic",
      "motion_magnitude": 0.2026,
      "raw_measurement": {
        "signal": "muscle_dof_stddev_rms",
        "raw_value": 0.13905,
        "divisor": 0.6864
      },
      "role": null,
      "motion_type": null,
      "contact": null,
      "constraint": null,
      "target": null,
      "motion_description": null,
      "mean_pose": {
        "Right Shoulder Down-Up": -0.48235,
        "Right Shoulder Front-Back": -0.62082,
        "Right Arm Down-Up": -0.39046,
        "Right Arm Front-Back": 0.32729,
        "Right Arm Twist In-Out": 0.1841,
        "Right Forearm Stretch": 0.66761,
        "Right Forearm Twist In-Out": 0.03341,
        "Right Hand Down-Up": -0.04705,
        "Right Hand In-Out": -0.40342
      }
    },
    "left_leg": {
      "kind": "fk_part",
      "state_label": "dynamic",
      "motion_magnitude": 0.4591,
      "raw_measurement": {
        "signal": "muscle_dof_stddev_rms",
        "raw_value": 0.20513,
        "divisor": 0.4468
      },
      "role": null,
      "motion_type": null,
      "contact": null,
      "constraint": null,
      "target": null,
      "motion_description": null,
      "mean_pose": {
        "Left Upper Leg Front-Back": -0.28026,
        "Left Upper Leg In-Out": 0.47032,
        "Left Upper Leg Twist In-Out": 0.42328,
        "Left Lower Leg Stretch": 0.36387,
        "Left Lower Leg Twist In-Out": 0.0062,
        "Left Foot Up-Down": -0.36806,
        "Left Foot Twist In-Out": 0.05081,
        "Left Toes Up-Down": -0.00532
      }
    },
    "right_leg": {
      "kind": "fk_part",
      "state_label": "dynamic",
      "motion_magnitude": 0.3542,
      "raw_measurement": {
        "signal": "muscle_dof_stddev_rms",
        "raw_value": 0.15824,
        "divisor": 0.4468
      },
      "role": null,
      "motion_type": null,
      "contact": null,
      "constraint": null,
      "target": null,
      "motion_description": null,
      "mean_pose": {
        "Right Upper Leg Front-Back": 0.00468,
        "Right Upper Leg In-Out": 0.10337,
        "Right Upper Leg Twist In-Out": 0.03814,
        "Right Lower Leg Stretch": 0.60384,
        "Right Lower Leg Twist In-Out": -0.09001,
        "Right Foot Up-Down": -0.12813,
        "Right Foot Twist In-Out": -0.28949,
        "Right Toes Up-Down": -0.27167
      }
    },
    "left_hand": {
      "kind": "hand",
      "state_label": "static",
      "motion_magnitude": 0.0,
      "raw_measurement": {
        "signal": "muscle_dof_stddev_rms",
        "raw_value": 0.0,
        "divisor": 0.7546
      },
      "role": null,
      "motion_type": null,
      "contact": null,
      "constraint": null,
      "target": null,
      "motion_description": null,
      "mean_pose": {
        "Left Thumb 1 Stretched": -1.41853,
        "Left Thumb Spread": -1.16639,
        "Left Thumb 2 Stretched": -0.18494,
        "Left Thumb 3 Stretched": -0.81076,
        "Left Index 1 Stretched": -0.43157,
        "Left Index Spread": -0.9846,
        "Left Index 2 Stretched": -0.6426,
        "Left Index 3 Stretched": -0.46906,
        "Left Middle 1 Stretched": -0.60802,
        "Left Middle Spread": -1.46563,
        "Left Middle 2 Stretched": -0.62264,
        "Left Middle 3 Stretched": -0.15003,
        "Left Ring 1 Stretched": -0.81874,
        "Left Ring Spread": 0.99054,
        "Left Ring 2 Stretched": -0.47409,
        "Left Ring 3 Stretched": -0.37911,
        "Left Little 1 Stretched": -0.99571,
        "Left Little Spread": 0.47744,
        "Left Little 2 Stretched": -0.62368,
        "Left Little 3 Stretched": -0.41066
      }
    },
    "right_hand": {
      "kind": "hand",
      "state_label": "dynamic",
      "motion_magnitude": 0.1886,
      "raw_measurement": {
        "signal": "muscle_dof_stddev_rms",
        "raw_value": 0.14235,
        "divisor": 0.7546
      },
      "role": null,
      "motion_type": null,
      "contact": null,
      "constraint": null,
      "target": null,
      "motion_description": null,
      "mean_pose": {
        "Right Thumb 1 Stretched": -1.76288,
        "Right Thumb Spread": 0.10537,
        "Right Thumb 2 Stretched": 0.11181,
        "Right Thumb 3 Stretched": 0.39246,
        "Right Index 1 Stretched": 0.49238,
        "Right Index Spread": -0.66434,
        "Right Index 2 Stretched": 0.38805,
        "Right Index 3 Stretched": 0.48074,
        "Right Middle 1 Stretched": 0.32501,
        "Right Middle Spread": -1.00975,
        "Right Middle 2 Stretched": 0.14398,
        "Right Middle 3 Stretched": 0.38476,
        "Right Ring 1 Stretched": 0.26631,
        "Right Ring Spread": 0.12346,
        "Right Ring 2 Stretched": -0.05938,
        "Right Ring 3 Stretched": 0.32798,
        "Right Little 1 Stretched": 0.06063,
        "Right Little Spread": -0.29116,
        "Right Little 2 Stretched": 0.05468,
        "Right Little 3 Stretched": 0.47934
      }
    }
  },
  "ik_goals": [],
  "composability": {
    "locks": [],
    "free": [
      "torso",
      "head",
      "left_arm",
      "right_arm",
      "left_leg",
      "right_leg",
      "left_hand",
      "right_hand"
    ],
    "can_overlay_on": [],
    "base_or_overlay": "overlay",
    "seam_owner": {
      "torso": "base",
      "root": "base"
    }
  },
  "extraction": {
    "method": "in_engine_sample_root_local",
    "sampled_frames": 197,
    "sampling_rule": "clamp(round(duration*frame_rate),2,600), native rate, HumanPose muscles + bodyPosition/bodyRotation",
    "motion_metric": "variation, all 8 anatomical channels: muscle_dof_stddev_rms, divided by torso 0.2969 / head 0.4963 / arm 0.6864 / leg 0.4468 / hand 0.7546; root variation: max(trans/1.9782, vert/1.8396, heading/131.8575) from HumanPose.bodyPosition and bodyRotation; mean pose, all 8 anatomical channels: mean_pose, the per-frame mean of each of the channel's Humanoid muscle degrees of freedom in Unity's normalised muscle space, stored as the vector it is and compared with nothing; root mean pose: mean_body_height (mean HumanPose.bodyPosition.y, normalised humanoid units) and mean_body_tilt_deg (mean angle of bodyRotation's up axis from world up)",
    "bone_map_version": "v2.0.0",
    "metric_formula_version": "v3.0.0",
    "extractor_version": "3.0.0",
    "extractor_lang": "python",
    "avatar": "nurse_avatar.fbx",
    "extracted_at": "2026-08-26T03:12:47Z",
    "field_origin": {
      "kinematic": [
        "duration",
        "frame_rate",
        "channels.*.state_label",
        "channels.*.motion_magnitude",
        "channels.*.raw_measurement",
        "channels.*.mean_pose",
        "channels.root.mean_body_height",